### DISCUSSION TITLE
Unable to setup Grpc keep alives

### DISCUSSION THREAD

**Discussion by ABAG603** [open-telemetry/opentelemetry-collector#14045] [Q&A]
Hi,

I'm trying to setup Grpc keep alives between 2 collectors but behavior is quite strange to me. Can someone please help to understand why is that and maybe suggest a working config?

Client config:

```yaml
receivers:
  otlp:
    protocols:
      grpc:
        endpoint: 0.0.0.0:4317
      http:
        endpoint: 0.0.0.0:4318

processors:

exporters:
  nop:
  otlp:
    endpoint: otel-receiver:4317
    timeout: 30s
    tls:
      insecure: true
    keepalive:
      time: 60s
      timeout: 5s
      permit_without_stream: true

service:
  pipelines:
    logs:
      receivers: [otlp]
      processors: [] 
      exporters: [nop]
      
    traces:
      receivers: [otlp]
      processors: []
      exporters: [otlp]
      
    metrics:
      receivers: [otlp]
      processors: [] 
      exporters: [nop]
```

Server config:

```yaml
receivers:
  otlp:
    protocols:
      grpc:
        endpoint: 0.0.0.0:4317
        keepalive:
          enforcement_policy:
            min_time: 30s
            permit_without_stream: true
      http:
        endpoint: 0.0.0.0:4318

processors:

exporters:
  nop:
  debug:

service:
  pipelines:
    logs:
      receivers: [otlp]
      processors: [] 
      exporters: [nop]
      
    traces:
      receivers: [otlp]
      processors: [] 
      exporters: [debug]
      
    metrics:
      receivers: [otlp]
      processors: []
      exporters: [nop]
```

And here's the dump file (I kept only keep alive entries there)

172.19.0.4 is a client
172.19.0.2 is a server

```
   16 2025-10-20 13:39:43.392721   172.19.0.2 → 172.19.0.4   TCP 66 [TCP Keep-Alive] 4317 → 33156 [ACK] Seq=160 Ack=2155 Win=534 Len=0 TSval=1891153207 TSecr=3564076566
   17 2025-10-20 13:39:43.392726   172.19.0.4 → 172.19.0.2   TCP 66 [TCP Keep-Alive ACK] 33156 → 4317 [ACK] Seq=2155 Ack=161 Win=502 Len=0 TSval=3564091575 TSecr=1891138157
   18 2025-10-20 13:39:58.751639   172.19.0.2 → 172.19.0.4   TCP 66 [TCP Keep-Alive] 4317 → 33156 [ACK] Seq=160 Ack=2155 Win=534 Len=0 TSval=1891168566 TSecr=3564091575
   19 2025-10-20 13:39:58.751650   172.19.0.4 → 172.19.0.2   TCP 66 [TCP Keep-Alive ACK] 33156 → 4317 [ACK] Seq=2155 Ack=161 Win=502 Len=0 TSval=3564106934 TSecr=1891138157
   22 2025-10-20 13:40:14.112350   172.19.0.2 → 172.19.0.4   TCP 66 [TCP Keep-Alive] 4317 → 33156 [ACK] Seq=160 Ack=2155 Win=534 Len=0 TSval=1891183927 TSecr=3564106934
   23 2025-10-20 13:40:14.112361   172.19.0.4 → 172.19.0.2   TCP 66 [TCP Keep-Alive ACK] 33156 → 4317 [ACK] Seq=2155 Ack=161 Win=502 Len=0 TSval=3564122295 TSecr=1891138157
   29 2025-10-20 13:40:43.806449   172.19.0.2 → 172.19.0.4   TCP 66 [TCP Keep-Alive] 4317 → 33156 [ACK] Seq=177 Ack=2172 Win=534 Len=0 TSval=1891213621 TSecr=3564136535
   30 2025-10-20 13:40:43.806458   172.19.0.4 → 172.19.0.2   TCP 66 [TCP Keep-Alive ACK] 33156 → 4317 [ACK] Seq=2172 Ack=178 Win=502 Len=0 TSval=3564151989 TSecr=1891198167
   31 2025-10-20 13:40:59.170824   172.19.0.2 → 172.19.0.4   TCP 66 [TCP Keep-Alive] 4317 → 33156 [ACK] Seq=177 Ack=2172 Win=534 Len=0 TSval=1891228985 TSecr=3564151989
   32 2025-10-20 13:40:59.170866   172.19.0.4 → 172.19.0.2   TCP 66 [TCP Keep-Alive ACK] 33156 → 4317 [ACK] Seq=2172 Ack=178 Win=502 Len=0 TSval=3564167353 TSecr=1891198167
   33 2025-10-20 13:41:14.531469   172.19.0.2 → 172.19.0.4   TCP 66 [TCP Keep-Alive] 4317 → 33156 [ACK] Seq=177 Ack=2172 Win=534 Len=0 TSval=1891244346 TSecr=3564167353
   34 2025-10-20 13:41:14.531503   172.19.0.4 → 172.19.0.2   TCP 66 [TCP Keep-Alive ACK] 33156 → 4317 [ACK] Seq=2172 Ack=178 Win=502 Len=0 TSval=3564182714 TSecr=1891198167
   42 2025-10-20 13:41:43.711003   172.19.0.2 → 172.19.0.4   TCP 66 [TCP Keep-Alive] 4317 → 33156 [ACK] Seq=194 Ack=2189 Win=534 Len=0 TSval=1891273525 TSecr=3564196544
   43 2025-10-20 13:41:43.711043   172.19.0.4 → 172.19.0.2   TCP 66 [TCP Keep-Alive ACK] 33156 → 4317 [ACK] Seq=2189 Ack=195 Win=502 Len=0 TSval=3564211894 TSecr=1891258176
   44 2025-10-20 13:41:59.072545   172.19.0.2 → 172.19.0.4   TCP 66 [TCP Keep-Alive] 4317 → 33156 [ACK] Seq=194 Ack=2189 Win=534 Len=0 TSval=1891288887 TSecr=3564211894
   45 2025-10-20 13:41:59.072579   172.19.0.4 → 172.19.0.2   TCP 66 [TCP Keep-Alive ACK] 33156 → 4317 [ACK] Seq=2189 Ack=195 Win=502 Len=0 TSval=3564227255 TSecr=1891258176
   46 2025-10-20 13:42:14.431068   172.19.0.2 → 172.19.0.4   TCP 66 [TCP Keep-Alive] 4317 → 33156 [ACK] Seq=194 Ack=2189 Win=534 Len=0 TSval=1891304245 TSecr=3564227255
   47 2025-10-20 13:42:14.431100   172.19.0.4 → 172.19.0.2   TCP 66 [TCP Keep-Alive ACK] 33156 → 4317 [ACK] Seq=2189 Ack=195 Win=502 Len=0 TSval=3564242613 TSecr=1891258176
   55 2025-10-20 13:42:43.619080   172.19.0.2 → 172.19.0.4   TCP 66 [TCP Keep-Alive] 4317 → 33156 [ACK] Seq=211 Ack=2206 Win=534 Len=0 TSval=1891333434 TSecr=3564256553
   56 2025-10-20 13:42:43.619097   172.19.0.4 → 172.19.0.2   TCP 66 [TCP Keep-Alive ACK] 33156 → 4317 [ACK] Seq=2206 Ack=212 Win=502 Len=0 TSval=3564271802 TSecr=1891318185
   57 2025-10-20 13:42:58.974713   172.19.0.2 → 172.19.0.4   TCP 66 [TCP Keep-Alive] 4317 → 33156 [ACK] Seq=211 Ack=2206 Win=534 Len=0 TSval=1891348789 TSecr=3564271802
   58 2025-10-20 13:42:58.974747   172.19.0.4 → 172.19.0.2   TCP 66 [TCP Keep-Alive ACK] 33156 → 4317 [ACK] Seq=2206 Ack=212 Win=502 Len=0 TSval=3564287157 TSecr=1891318185
   59 2025-10-20 13:43:14.335596   172.19.0.2 → 172.19.0.4   TCP 66 [TCP Keep-Alive] 4317 → 33156 [ACK] Seq=211 Ack=2206 Win=534 Len=0 TSval=1891364150 TSecr=3564287157
   60 2025-10-20 13:43:14.335636   172.19.0.4 → 172.19.0.2   TCP 66 [TCP Keep-Alive ACK] 33156 → 4317 [ACK] Seq=2206 Ack=212 Win=502 Len=0 TSval=3564302518 TSecr=1891318185
   68 2025-10-20 13:43:43.526997   172.19.0.2 → 172.19.0.4   TCP 66 [TCP Keep-Alive] 4317 → 33156 [ACK] Seq=228 Ack=2223 Win=534 Len=0 TSval=1891393341 TSecr=3564316560
   69 2025-10-20 13:43:43.527004   172.19.0.4 → 172.19.0.2   TCP 66 [TCP Keep-Alive ACK] 33156 → 4317 [ACK] Seq=2223 Ack=229 Win=502 Len=0 TSval=3564331709 TSecr=1891378192
   70 2025-10-20 13:43:58.888379   172.19.0.2 → 172.19.0.4   TCP 66 [TCP Keep-Alive] 4317 → 33156 [ACK] Seq=228 Ack=2223 Win=534 Len=0 TSval=1891408703 TSecr=3564331709
   71 2025-10-20 13:43:58.888406   172.19.0.4 → 172.19.0.2   TCP 66 [TCP Keep-Alive ACK] 33156 → 4317 [ACK] Seq=2223 Ack=229 Win=502 Len=0 TSval=3564347071 TSecr=1891378192
   72 2025-10-20 13:44:14.246408   172.19.0.2 → 172.19.0.4   TCP 66 [TCP Keep-Alive] 4317 → 33156 [ACK] Seq=228 Ack=2223 Win=534 Len=0 TSval=1891424061 TSecr=3564347071
   73 2025-10-20 13:44:14.246434   172.19.0.4 → 172.19.0.2   TCP 66 [TCP Keep-Alive ACK] 33156 → 4317 [ACK] Seq=2223 Ack=229 Win=502 Len=0 TSval=3564362429 TSecr=1891378192
   81 2025-10-20 13:44:43.422259   172.19.0.2 → 172.19.0.4   TCP 66 [TCP Keep-Alive] 4317 → 33156 [ACK] Seq=245 Ack=2240 Win=534 Len=0 TSval=1891453237 TSecr=3564376574
   82 2025-10-20 13:44:43.422278   172.19.0.4 → 172.19.0.2   TCP 66 [TCP Keep-Alive ACK] 33156 → 4317 [ACK] Seq=2240 Ack=246 Win=502 Len=0 TSval=3564391605 TSecr=1891438206
   83 2025-10-20 13:44:58.782826   172.19.0.2 → 172.19.0.4   TCP 66 [TCP Keep-Alive] 4317 → 33156 [ACK] Seq=245 Ack=2240 Win=534 Len=0 TSval=1891468597 TSecr=3564391605
   84 2025-10-20 13:44:58.782848   172.19.0.4 → 172.19.0.2   TCP 66 [TCP Keep-Alive ACK] 33156 → 4317 [ACK] Seq=2240 Ack=246 Win=502 Len=0 TSval=3564406965 TSecr=1891438206
   85 2025-10-20 13:45:14.143376   172.19.0.2 → 172.19.0.4   TCP 66 [TCP Keep-Alive] 4317 → 33156 [ACK] Seq=245 Ack=2240 Win=534 Len=0 TSval=1891483957 TSecr=3564406965
   86 2025-10-20 13:45:14.143414   172.19.0.4 → 172.19.0.2   TCP 66 [TCP Keep-Alive ACK] 33156 → 4317 [ACK] Seq=2240 Ack=246 Win=502 Len=0 TSval=3564422326 TSecr=1891438206
   94 2025-10-20 13:45:43.839116   172.19.0.2 → 172.19.0.4   TCP 66 [TCP Keep-Alive] 4317 → 33156 [ACK] Seq=262 Ack=2257 Win=534 Len=0 TSval=1891513653 TSecr=3564436582
   95 2025-10-20 13:45:43.839143   172.19.0.4 → 172.19.0.2   TCP 66 [TCP Keep-Alive ACK] 33156 → 4317 [ACK] Seq=2257 Ack=263 Win=502 Len=0 TSval=3564452021 TSecr=1891498214
   96 2025-10-20 13:45:59.202689   172.19.0.2 → 172.19.0.4   TCP 66 [TCP Keep-Alive] 4317 → 33156 [ACK] Seq=262 Ack=2257 Win=534 Len=0 TSval=1891529016 TSecr=3564452021
   97 2025-10-20 13:45:59.202717   172.19.0.4 → 172.19.0.2   TCP 66 [TCP Keep-Alive ACK] 33156 → 4317 [ACK] Seq=2257 Ack=263 Win=502 Len=0 TSval=3564467384 TSecr=1891498214
   98 2025-10-20 13:46:14.566483   172.19.0.2 → 172.19.0.4   TCP 66 [TCP Keep-Alive] 4317 → 33156 [ACK] Seq=262 Ack=2257 Win=534 Len=0 TSval=1891544380 TSecr=3564467384
   99 2025-10-20 13:46:14.566546   172.19.0.4 → 172.19.0.2   TCP 66 [TCP Keep-Alive ACK] 33156 → 4317 [ACK] Seq=2257 Ack=263 Win=502 Len=0 TSval=3564482748 TSecr=1891498214
```

Few questions:
1. Why keep alive is initiated always by the server and not by the client?
2. Why are they sometimes sent with 15s interval and sometimes with 30s interval? I'd expect 1 minute interval as I configured for the client.

**Comment by s3onghyun** [comment]
The short version: what you're capturing in Wireshark and what you configured are two different keepalive mechanisms.

**Those packets are TCP keepalives, not your gRPC keepalives.** Every frame in your capture is labelled `[TCP Keep-Alive]` with `Len=0` — that's the OS TCP stack probing an idle socket. The gRPC keepalive you set on the exporter is an *HTTP/2* mechanism: `config/configgrpc` maps `keepalive.{time,timeout,permit_without_stream}` straight onto grpc-go's [`keepalive.ClientParameters`](https://pkg.go.dev/google.golang.org/grpc/keepalive#ClientParameters), which sends **HTTP/2 PING frames**. Those carry an 8-byte payload and show up in Wireshark as `HTTP2 ... PING`, not as `[TCP Keep-Alive]`. So none of the packets you pasted are the ones your config produced.

That clears up both questions:

1. **"Why is it always the server initiating?"** — The source port on those probes is `4317`, i.e. they originate from the *receiver's* socket, driven by its OS TCP stack (and/or the server's `keepalive.server_parameters`). It's independent of the exporter-side `keepalive` block on your client. Your client's gRPC PINGs are separate frames you haven't filtered for yet.

2. **"Why 15s/30s instead of my 60s?"** — TCP keepalive timing comes from OS sysctls (`net.ipv4.tcp_keepalive_time/intvl`), not from your `time: 60s`. And the TCP keepalive timer resets whenever *any* segment crosses the connection, so with other traffic interleaved the observed gaps look irregular (your 15s/30s). Your `time: 60s` only governs the HTTP/2 PING cadence.

**To actually see your configured keepalive**, filter for HTTP/2 PINGs:

```
http2.type == 6
```

With `permit_without_stream: true` and `time: 60s`, the client should emit a PING roughly every 60s from the exporter side even when no RPC stream is active. One thing to watch: grpc-go enforces a server-side minimum via `enforcement_policy` (the `min_time` / `permit_without_stream` on your server `keepalive` block). If the client pings faster than the server permits, the server answers with a GOAWAY "too_many_pings" and tears the connection down — so keep the client `time` >= the server's `enforcement_policy.min_time`.

If you were expecting the exporter to keep an otherwise-idle connection warm, `permit_without_stream: true` + a `time` at or above the server's `min_time` is the right combination; the `[TCP Keep-Alive]` traffic you saw was never the thing to look at.
