### ISSUE TITLE
Otel Log Collector (Connection Reset From Rsyslog)

### ISSUE THREAD

**Issue by roomit-xyz** [open-telemetry/opentelemetry-collector#8944]
Dear Team,

I have some issue regarding forward log rsyslog to otel-collector. otel-collector can not accepted log from rsyslog.

With Diagram flow

VM (rsyslog) => Signoz (Accept by signoz-otel-collector) Port 54527/tcp

Configuration Rsyslog : 

The first I tried :
```
*.* action(type="omfwd" target="zzzzzzz" port="54527" protocol="tcp"
           action.resumeRetryCount="10"
           queue.type="linkedList" queue.size="10000")

```

The second I tried :
```
template(
  name="UTCTraditionalForwardFormat"
  type="string"
  string="<%PRI%>%TIMESTAMP:::date-utc% %HOSTNAME% %syslogtag:1:32%%msg:::sp-if-no-1st-sp%%msg%"
)

*.* action(type="omfwd" target="zzzzzzz" port="54527" protocol="tcp" template="UTCTraditionalForwardFormat")
```

I have recieved traffic on both testing :
```
22:35:26.618959 IP xxxxxxxxxx.37194 > zzzzzzz.54527: Flags [S], seq 3185926307, win 29200, options [mss 1380,sackOK,TS val 1696885558 ecr 0,nop,wscale 7], length 0
22:35:26.618999 IP xxxxxxxxxx.37194 > 172.24.0.9.54527: Flags [S], seq 3185926307, win 29200, options [mss 1380,sackOK,TS val 1696885558 ecr 0,nop,wscale 7], length 0
22:35:26.619002 IP xxxxxxxxxx.37194 > 172.24.0.9.54527: Flags [S], seq 3185926307, win 29200, options [mss 1380,sackOK,TS val 1696885558 ecr 0,nop,wscale 7], length 0
22:35:26.620501 IP xxxxxxxxxx.37194 > zzzzzzz.54527: Flags [.], ack 59522303, win 229, options [nop,nop,TS val 1696885560 ecr 3198929257], length 0
22:35:26.620526 IP xxxxxxxxxx.37194 > 172.24.0.9.54527: Flags [.], ack 59522303, win 229, options [nop,nop,TS val 1696885560 ecr 3198929257], length 0
22:35:26.620531 IP xxxxxxxxxx.37194 > 172.24.0.9.54527: Flags [.], ack 1, win 229, options [nop,nop,TS val 1696885560 ecr 3198929257], length 0
22:35:26.620746 IP xxxxxxxxxx37194 > zzzzzzz.54527: Flags [R.], seq 0, ack 1, win 229, length 0
22:35:26.620753 IP xxxxxxxxxx.37194 > 172.24.0.9.54527: Flags [R.], seq 0, ack 1, win 229, length 0
```

But in Logging signoz-otel-collector

```
2023-11-17T03:39:07.113Z	error	tcp/tcp.go:281	Scanner error	{"kind": "receiver", "name": "syslog", "data_type": "logs", "operator_id": "syslog_input_internal_tcp", "operator_type": "tcp_input", "error": "read tcp 172.24.0.9:54527->xxxxxxxxxx:43310: **read: connection reset by peer"**}
github.com/open-telemetry/opentelemetry-collector-contrib/pkg/stanza/operator/input/tcp.(*Input).goHandleMessages.func1
	/home/runner/go/pkg/mod/github.com/open-telemetry/opentelemetry-collector-contrib/pkg/stanza@v0.79.0/operator/input/tcp/tcp.go:281

```

Connection to signoz establihed if we checked 
```
telnet zzzzzzz 54527
Trying zzzzzzz...
Connected to zzzzzzz.
Escape character is '^]'.
````

signoz-collector configuration 
```
receivers:
..............................
  syslog:
    tcp:
      listen_address: "0.0.0.0:54527"
    protocol: rfc3164
    location: UTC
    operators:
      - type: move
        from: attributes.message
        to: body
.................................
```

ith humility, I kindly request for the solution: is there a configuration in the OpenTelemetry (otel) Collector to receive logs from syslog?
