### ISSUE TITLE
Much ACK packet sending by collector agent

### ISSUE THREAD

**Issue by chinawilon** [open-telemetry/opentelemetry-collector#8553]
I use the OpenTelemetry-Collector as agent co-located with my application . My application is a swoole(php) asynchronous service and I use http/protobuf protocol to write data to collector. It worked fine, but I found that the collector was sending a lot of ACK packets back to the php process . I don't know how this happened, and is there something wrong with my configuration?

tcpdump -i any port 4318
```shell
10:54:53.333424 eth0  In  IP longmao-opentelemetry-collector.default.svc.cluster.local.4318 > new-yisdk-service-cli-66c9cb9b78-dp2dk.33750: Flags [.], ack 1, win 501, options [nop,nop,TS val 4110288046 ecr 4016623107], length 0
10:54:53.333429 eth0  Out IP new-yisdk-service-cli-66c9cb9b78-dp2dk.33750 > longmao-opentelemetry-collector.default.svc.cluster.local.4318: Flags [.], ack 1, win 502, options [nop,nop,TS val 4016638467 ecr 4071644582], length 0
10:55:08.671244 eth0  In  IP longmao-opentelemetry-collector.default.svc.cluster.local.4318 > new-yisdk-service-cli-66c9cb9b78-dp2dk.33750: Flags [.], ack 1, win 501, options [nop,nop,TS val 4110303406 ecr 4016638467], length 0
10:55:08.671246 eth0  Out IP new-yisdk-service-cli-66c9cb9b78-dp2dk.33750 > longmao-opentelemetry-collector.default.svc.cluster.local.4318: Flags [.], ack 1, win 502, options [nop,nop,TS val 4016653827 ecr 4071644582], length 0
10:55:24.031809 eth0  In  IP longmao-opentelemetry-collector.default.svc.cluster.local.4318 > new-yisdk-service-cli-66c9cb9b78-dp2dk.33750: Flags [.], ack 1, win 501, options [nop,nop,TS val 4110318766 ecr 4016653827], length 0
10:55:24.031814 eth0  Out IP new-yisdk-service-cli-66c9cb9b78-dp2dk.33750 > longmao-opentelemetry-collector.default.svc.cluster.local.4318: Flags [.], ack 1, win 502, options [nop,nop,TS val 4016669187 ecr 4071644582], length 0
10:55:39.370643 eth0  In  IP longmao-opentelemetry-collector.default.svc.cluster.local.4318 > new-yisdk-service-cli-66c9cb9b78-dp2dk.33750: Flags [.], ack 1, win 501, options [nop,nop,TS val 4110334126 ecr 4016669187], length 0
10:55:39.370645 eth0  Out IP new-yisdk-service-cli-66c9cb9b78-dp2dk.33750 > longmao-opentelemetry-collector.default.svc.cluster.local.4318: Flags [.], ack 1, win 502, options [nop,nop,TS val 4016684548 ecr 4071644582], length 0
10:55:54.729920 eth0  In  IP longmao-opentelemetry-collector.default.svc.cluster.local.4318 > new-yisdk-service-cli-66c9cb9b78-dp2dk.33750: Flags [.], ack 1, win 501, options [nop,nop,TS val 4110349486 ecr 4016684548], length 0
10:55:54.729924 eth0  Out IP new-yisdk-service-cli-66c9cb9b78-dp2dk.33750 > longmao-opentelemetry-collector.default.svc.cluster.local.4318: Flags [.], ack 1, win 502, options [nop,nop,TS val 4016699907 ecr 4071644582], length 0
10:56:10.067918 eth0  In  IP longmao-opentelemetry-collector.default.svc.cluster.local.4318 > new-yisdk-service-cli-66c9cb9b78-dp2dk.33750: Flags [.], ack 1, win 501, options [nop,nop,TS val 4110364845 ecr 4016699907], length 0
10:56:10.067920 eth0  Out IP new-yisdk-service-cli-66c9cb9b78-dp2dk.33750 > longmao-opentelemetry-collector.default.svc.cluster.local.4318: Flags [.], ack 1, win 502, options [nop,nop,TS val 4016715267 ecr 4071644582], length 0
10:56:25.428007 eth0  In  IP longmao-opentelemetry-collector.default.svc.cluster.local.4318 > new-yisdk-service-cli-66c9cb9b78-dp2dk.33750: Flags [.], ack 1, win 501, options [nop,nop,TS val 4110380205 ecr 4016715267], length 0
10:56:25.428011 eth0  Out IP new-yisdk-service-cli-66c9cb9b78-dp2dk.33750 > longmao-opentelemetry-collector.default.svc.cluster.local.4318: Flags [.], ack 1, win 502, options [nop,nop,TS val 4016730627 ecr 4071644582], length 0
10:56:40.745004 eth0  In  IP longmao-opentelemetry-collector.default.svc.cluster.local.4318 > new-yisdk-service-cli-66c9cb9b78-dp2dk.33750: Flags [.], ack 1, win 501, options [nop,nop,TS val 4110395566 ecr 4016730627], length 0
10:56:40.745006 eth0  Out IP new-yisdk-service-cli-66c9cb9b78-dp2dk.33750 > longmao-opentelemetry-collector.default.svc.cluster.local.4318: Flags [.], ack 1, win 502, options [nop,nop,TS val 4016745987 ecr 4071644582], length 0
10:56:56.105312 eth0  In  IP longmao-opentelemetry-collector.default.svc.cluster.local.4318 > new-yisdk-service-cli-66c9cb9b78-dp2dk.33750: Flags [.], ack 1, win 501, options [nop,nop,TS val 4110410926 ecr 4016745987], length 0
10:56:56.105317 eth0  Out IP new-yisdk-service-cli-66c9cb9b78-dp2dk.33750 > longmao-opentelemetry-collector.default.svc.cluster.local.4318: Flags [.], ack 1, win 502, options [nop,nop,TS val 4016761347 ecr 4071644582], length 0
10:57:11.433355 eth0  In  IP longmao-opentelemetry-collector.default.svc.cluster.local.4318 > new-yisdk-service-cli-66c9cb9b78-dp2dk.33750: Flags [.], ack 1, win 501, options [nop,nop,TS val 4110426286 ecr 4016761347], length 0
10:57:11.433358 eth0  Out IP new-yisdk-service-cli-66c9cb9b78-dp2dk.33750 > longmao-opentelemetry-collector.default.svc.cluster.local.4318: Flags [.], ack 1, win 502, options [nop,nop,TS val 4016776707 ecr 4071644582], length 0
10:57:26.794058 eth0  In  IP longmao-opentelemetry-collector.default.svc.cluster.local.4318 > new-yisdk-service-cli-66c9cb9b78-dp2dk.33750: Flags [.], ack 1, win 501, options [nop,nop,TS val 4110441646 ecr 4016776707], length 0
10:57:26.794066 eth0  Out IP new-yisdk-service-cli-66c9cb9b78-dp2dk.33750 > longmao-opentelemetry-collector.default.svc.cluster.local.4318: Flags [.], ack 1, win 502, options [nop,nop,TS val 4016792068 ecr 4071644582], length 0
10:57:42.128035 eth0  In  IP longmao-opentelemetry-collector.default.svc.cluster.local.4318 > new-yisdk-service-cli-66c9cb9b78-dp2dk.33750: Flags [.], ack 1, win 501, options [nop,nop,TS val 4110457006 ecr 4016792068], length 0
10:57:42.128038 eth0  Out IP new-yisdk-service-cli-66c9cb9b78-dp2dk.33750 > longmao-opentelemetry-collector.default.svc.cluster.local.4318: Flags [.], ack 1, win 502, options [nop,nop,TS val 4016807427 ecr 4071644582], length 0
10:57:57.487715 eth0  In  IP longmao-opentelemetry-collector.default.svc.cluster.local.4318 > new-yisdk-service-cli-66c9cb9b78-dp2dk.33750: Flags [.], ack 1, win 501, options [nop,nop,TS val 4110472365 ecr 4016807427], length 0
10:57:57.487719 eth0  Out IP new-yisdk-service-cli-66c9cb9b78-dp2dk.33750 > longmao-opentelemetry-collector.default.svc.cluster.local.4318: Flags [.], ack 1, win 502, options [nop,nop,TS val 4016822787 ecr 4071644582], length 0
10:58:12.827648 eth0  In  IP longmao-opentelemetry-collector.default.svc.cluster.local.4318 > new-yisdk-service-cli-66c9cb9b78-dp2dk.33750: Flags [.], ack 1, win 501, options [nop,nop,TS val 4110487725 ecr 4016822787], length 0
10:58:12.827650 eth0  Out IP new-yisdk-service-cli-66c9cb9b78-dp2dk.33750 > longmao-opentelemetry-collector.default.svc.cluster.local.4318: Flags [.], ack 1, win 502, options [nop,nop,TS val 4016838147 ecr 4071644582], length 0
10:58:28.187806 eth0  In  IP longmao-opentelemetry-collector.default.svc.cluster.local.4318 > new-yisdk-service-cli-66c9cb9b78-dp2dk.33750: Flags [.], ack 1, win 501, options [nop,nop,TS val 4110503086 ecr 4016838147], length 0
10:58:28.187810 eth0  Out IP new-yisdk-service-cli-66c9cb9b78-dp2dk.33750 > longmao-opentelemetry-collector.default.svc.cluster.local.4318: Flags [.], ack 1, win 502, options [nop,nop,TS val 4016853507 ecr 4071644582], length 0
10:58:43.525744 eth0  In  IP longmao-opentelemetry-collector.default.svc.cluster.local.4318 > new-yisdk-service-cli-66c9cb9b78-dp2dk.33750: Flags [.], ack 1, win 501, options [nop,nop,TS val 4110518446 ecr 4016853507], length 0
10:58:43.525747 eth0  Out IP new-yisdk-service-cli-66c9cb9b78-dp2dk.33750 > longmao-opentelemetry-collector.default.svc.cluster.local.4318: Flags [.], ack 1, win 502, options [nop,nop,TS val 4016868867 ecr 4071644582], length 0
10:58:58.885737 eth0  In  IP longmao-opentelemetry-collector.default.svc.cluster.local.4318 > new-yisdk-service-cli-66c9cb9b78-dp2dk.33750: Flags [.], ack 1, win 501, options [nop,nop,TS val 4110533806 ecr 4016868867], length 0
10:58:58.885741 eth0  Out IP new-yisdk-service-cli-66c9cb9b78-dp2dk.33750 > longmao-opentelemetry-collector.default.svc.cluster.local.4318: Flags [.], ack 1, win 502, options [nop,nop,TS val 4016884227 ecr 4071644582], length 0
```

opentelemetry-collector-config.yaml
```yaml
exporters:
  otlp:
    endpoint: pl.ap-guangzhou.apm.tencentcs.com:4317
    tls:
      insecure: true
processors:
  resource:
    attributes:
      - key: token
        value: "xxxxxxxxxxxxxxxxxxxxxx"
        action: upsert
  batch:
    send_batch_size: 10000
    timeout: 10s
receivers:
  otlp:
    protocols:
      grpc:
        endpoint: 127.0.0.1:4317
      http:
        endpoint: 127.0.0.1:4318
service:
  telemetry:
    logs:
      level: debug
    metrics:
      level: detailed
      address: 0.0.0.0:18888
  pipelines:
    traces:
      processors:
        - resource
        - batch
      exporters:
        - otlp
      receivers:
        - otlp
```

environments
```env
OTEL_PHP_AUTOLOAD_ENABLED=true
OTEL_SERVICE_NAME=yisdk-api
OTEL_SDK_DISABLED=false
OTEL_PROPAGATORS=b3
OTEL_TRACES_EXPORTER=otlp
OTEL_METRICS_EXPORTER=none
OTEL_LOGS_EXPORTER=none
OTEL_EXPORTER_OTLP_PROTOCOL=http/protobuf
#OTEL_EXPORTER_OTLP_PROTOCOL=http/json
OTEL_EXPORTER_OTLP_ENDPOINT=http://longmao-opentelemetry-collector:4318/
OTEL_TRACES_SAMPLER="always_on"
#OTEL_TRACES_SAMPLER="traceidratio"
#OTEL_TRACES_SAMPLER_ARG="0.1"
#OTEL_EXPORTER_OTLP_HEADERS="Connection=keep-alive"
```

**Comment by atoulme** [comment]
Anything in the collector logs?

**Comment by chinawilon** [comment]
No, but I found that it sends an ACK packet every 15 seconds, and I didn't find the corresponding interval configuration in the collector source code.
